{
    "id": "asthma-guidelines",
    "version": "1.0.0",
    "name": "Asthma Guidelines",
    "description": "Clinical guideline for asthma management.",
    "root_id": "root",
    "nodes": [
        {
            "id": "root",
            "type": "root",
            "label": "Start assessment",
            "description": "Begin triage flow"
        },
        {
            "id": "node1",
            "type": "question",
            "origin": "root",
            "output_type": "string",
            "output_map": {
                "Under 18": "outcome1",
                "18-30": "outcome2",
                "31+": "outcome3"
            },
            "label": "What is your age?",
            "description": "",
            "condition": {
                "variable": "entry_point",
                "operator": "==",
                "threshold": "start_assessment"
            },
            "metadata": {
                "question": {
                    "value_type": "number",
                    "unit": "years",
                    "threshold": 18,
                    "options": [
                        "Under 18",
                        "18-30",
                        "31+"
                    ]
                }
            }
        },
        {
            "id": "node2",
            "type": "question",
            "origin": "root",
            "output_type": "string",
            "output_map": {
                "Student": "outcome4",
                "Professional": "outcome5",
                "Retired": "outcome6"
            },
            "label": "What is your occupation?",
            "description": "",
            "condition": {
                "variable": "entry_point",
                "operator": "==",
                "threshold": "start_assessment"
            },
            "metadata": {
                "question": {
                    "value_type": "string",
                    "unit": "",
                    "threshold": 0,
                    "options": [
                        "Student",
                        "Professional",
                        "Retired"
                    ]
                }
            }
        },
        {
            "id": "outcome1",
            "type": "outcome",
            "origin": "node1",
            "label": "Under 18",
            "description": "",
            "condition": {
                "variable": "node1",
                "operator": "==",
                "threshold": "Under 18"
            }
        },
        {
            "id": "outcome2",
            "type": "outcome",
            "origin": "node1",
            "label": "18-30",
            "description": "",
            "condition": {
                "variable": "node1",
                "operator": "==",
                "threshold": "18-30"
            }
        },
        {
            "id": "outcome3",
            "type": "outcome",
            "origin": "node1",
            "label": "31+",
            "description": "",
            "condition": {
                "variable": "node1",
                "operator": "==",
                "threshold": "31+"
            }
        },
        {
            "id": "outcome4",
            "type": "outcome",
            "origin": "node2",
            "label": "Student",
            "description": "",
            "condition": {
                "variable": "node2",
                "operator": "==",
                "threshold": "Student"
            }
        },
        {
            "id": "outcome5",
            "type": "outcome",
            "origin": "node2",
            "label": "Professional",
            "description": "",
            "condition": {
                "variable": "node2",
                "operator": "==",
                "threshold": "Professional"
            }
        },
        {
            "id": "outcome6",
            "type": "outcome",
            "origin": "node2",
            "label": "Retired",
            "description": "",
            "condition": {
                "variable": "node2",
                "operator": "==",
                "threshold": "Retired"
            }
        }
    ],
    "edges": [
        {
            "source_id": "root",
            "target_id": "node1",
            "label": "Yes"
        },
        {
            "source_id": "root",
            "target_id": "node2",
            "label": "No"
        },
        {
            "source_id": "node1",
            "target_id": "outcome1",
            "label": "Under 18"
        },
        {
            "source_id": "node1",
            "target_id": "outcome2",
            "label": "18-30"
        },
        {
            "source_id": "node1",
            "target_id": "outcome3",
            "label": "31+"
        },
        {
            "source_id": "node2",
            "target_id": "outcome4",
            "label": "Student"
        },
        {
            "source_id": "node2",
            "target_id": "outcome5",
            "label": "Professional"
        },
        {
            "source_id": "node2",
            "target_id": "outcome6",
            "label": "Retired"
        }
    ]
}