{
    "id": "asthma_guidelines",
    "version": "1.0.0",
    "name": "Asthma Medication Decision Tree",
    "description": "Decision tree for determining the use of asthma medications.",
    "root_id": "root",
    "nodes": [
        {
            "id": "root",
            "type": "root",
            "label": "Clinical Decision Point",
            "description": "This is the root node representing the clinical decision-making process.",
            "origin": null,
            "output_type": "string",
            "output_map": {},
            "condition": {},
            "metadata": {}
        },
        {
            "id": "question_1",
            "type": "question",
            "label": "Medication Type",
            "description": "What type of medication is being considered?",
            "origin": "root",
            "output_type": "string",
            "output_map": {
                "yes": "node_1",
                "no": "node_2"
            },
            "condition": {
                "variable": "medication_type",
                "operator": "=",
                "threshold": "ICS or LABA"
            },
            "metadata": {
                "question": {
                    "prompt": "What type of medication is being considered?",
                    "choices": [
                        "ICS",
                        "LABA",
                        "Other"
                    ]
                }
            }
        },
        {
            "id": "node_1",
            "type": "outcome",
            "label": "ICS",
            "description": "Decision to use Inhaled Corticosteroids (ICS) as a medication.",
            "origin": "question_1",
            "output_type": "boolean",
            "output_map": {
                "true": "node_3",
                "false": "node_4"
            },
            "condition": {
                "variable": "ics_used",
                "operator": ">=",
                "threshold": "5"
            },
            "metadata": {
                "question": {
                    "prompt": "Should Inhaled Corticosteroids (ICS) be used?",
                    "choices": [
                        "Yes",
                        "No"
                    ]
                }
            }
        },
        {
            "id": "node_2",
            "type": "outcome",
            "label": "LABA",
            "description": "Decision to use Long-Acting Beta2-Agonists (LABA) as a medication.",
            "origin": "question_1",
            "output_type": "boolean",
            "output_map": {
                "true": "node_5",
                "false": "node_6"
            },
            "condition": {
                "variable": "labas_used",
                "operator": "<=",
                "threshold": "10"
            },
            "metadata": {
                "question": {
                    "prompt": "Should Long-Acting Beta2-Agonists (LABA) be used?",
                    "choices": [
                        "Yes",
                        "No"
                    ]
                }
            }
        },
        {
            "id": "node_3",
            "type": "outcome",
            "label": "Use ICS",
            "description": "ICS should be used.",
            "origin": "node_1",
            "output_type": "boolean",
            "output_map": {},
            "condition": {},
            "metadata": {}
        },
        {
            "id": "node_4",
            "type": "outcome",
            "label": "Do Not Use ICS",
            "description": "ICS should not be used.",
            "origin": "node_1",
            "output_type": "boolean",
            "output_map": {},
            "condition": {},
            "metadata": {}
        },
        {
            "id": "node_5",
            "type": "outcome",
            "label": "Use LABA",
            "description": "LABA should be used.",
            "origin": "node_2",
            "output_type": "boolean",
            "output_map": {},
            "condition": {},
            "metadata": {}
        },
        {
            "id": "node_6",
            "type": "outcome",
            "label": "Do Not Use LABA",
            "description": "LABA should not be used.",
            "origin": "node_2",
            "output_type": "boolean",
            "output_map": {},
            "condition": {},
            "metadata": {}
        }
    ],
    "edges": [
        {
            "source_id": "root",
            "target_id": "question_1",
            "label": "Start"
        },
        {
            "source_id": "question_1",
            "target_id": "node_1",
            "label": "ICS Decision"
        },
        {
            "source_id": "node_1",
            "target_id": "node_3",
            "label": "Use ICS"
        },
        {
            "source_id": "node_1",
            "target_id": "node_4",
            "label": "Do Not Use ICS"
        },
        {
            "source_id": "node_2",
            "target_id": "node_5",
            "label": "Use LABA"
        },
        {
            "source_id": "node_2",
            "target_id": "node_6",
            "label": "Do Not Use LABA"
        }
    ]
}